{
  "schema": "flexfactor.purpose_contract.v2",
  "name": "FlexFactor",
  "historical_purpose": "A local dual-provider refactorer that grew into a managed purpose-driven audit, repair, verification, and publication system.",
  "purpose": "Be a trustworthy local expert that audits or improves code without retaining unverified changes, leaking sensitive source, or executing untrusted dependencies outside containment, while producing reproducible evidence and deterministic rollback.",
  "current_behavior": [
    {
      "id": "cb-1",
      "text": "One durable orchestrator admits 1 through 30 targets sequentially.",
      "confidence": "verified",
      "evidence_refs": [
        0
      ]
    },
    {
      "id": "cb-2",
      "text": "Audit and Production Ready use at most six passes: the whole repository, a configurable competitor gate defaulting to 25, then verified edit deltas.",
      "confidence": "verified",
      "evidence_refs": [
        0,
        2
      ]
    },
    {
      "id": "cb-3",
      "text": "Owner coding uses subscriptions before metered APIs and then free/local, strongest first per class. All cloud, CLI, Cursor and research payloads obey the egress gate.",
      "confidence": "verified",
      "evidence_refs": [
        1,
        2
      ]
    },
    {
      "id": "cb-4",
      "text": "One run shares author-family identity; final review requires a non-author family or fails closed.",
      "confidence": "verified",
      "evidence_refs": [
        1,
        2
      ]
    },
    {
      "id": "cb-5",
      "text": "Checkpoints stay local; changed-run completion requires green gates, exact-commit independent review, and remote-default ancestry proof.",
      "confidence": "verified",
      "evidence_refs": [
        2
      ]
    },
    {
      "id": "cb-6",
      "text": "Android persists the queue; cloud claims request UUIDs atomically, recovers dispatch after crashes, and removes phone-supplied secrets at terminal status.",
      "confidence": "verified",
      "evidence_refs": [
        3,
        4,
        6
      ]
    }
  ],
  "aspirations": [
    {
      "id": "asp-1",
      "text": "OS-enforced Windows network isolation in addition to current process-tree and resource controls.",
      "confidence": "unknown",
      "evidence_refs": [
        2
      ]
    }
  ],
  "users": [
    {
      "id": "u-1",
      "text": "Owners running Refactor, Scout, Audit, or Production Ready from Android, desktop launchers, or CLI.",
      "confidence": "verified",
      "evidence_refs": [
        0,
        2,
        3
      ]
    },
    {
      "id": "u-2",
      "text": "Supervisors consuming statuses, receipts, manifests, error ledgers, and evidence bundles.",
      "confidence": "verified",
      "evidence_refs": [
        0,
        2
      ]
    }
  ],
  "outcomes": [
    {
      "id": "o-1",
      "text": "Verified corrections reach the authoritative default branch without force-push; owner WIP is restored by fingerprint.",
      "confidence": "verified",
      "evidence_refs": [
        2
      ]
    },
    {
      "id": "o-2",
      "text": "Incomplete provider, verification, review, publication, or release conditions stay BLOCKED or IN PROGRESS.",
      "confidence": "verified",
      "evidence_refs": [
        2,
        7
      ]
    }
  ],
  "workflows": [
    {
      "id": "w-1",
      "text": "Audit checks purpose, repository, competitors, and verified deltas, then verifies, independently reviews, and publishes.",
      "confidence": "verified",
      "evidence_refs": [
        0,
        2
      ]
    },
    {
      "id": "w-2",
      "text": "Production Ready adds the full readiness rubric to Audit.",
      "confidence": "verified",
      "evidence_refs": [
        2
      ]
    },
    {
      "id": "w-3",
      "text": "Scout researches improvements; mutation requires explicit authorization and normal verification and publication.",
      "confidence": "verified",
      "evidence_refs": [
        2
      ]
    },
    {
      "id": "w-4",
      "text": "Refactor changes selected files only after project verification, independent review, and publication proof.",
      "confidence": "verified",
      "evidence_refs": [
        2
      ]
    }
  ],
  "invariants": [
    {
      "id": "i-1",
      "text": "Audit/Production Ready attempt repair and publication, never report-only. Scout apply requires authorization.",
      "confidence": "supported",
      "evidence_refs": [
        5,
        8
      ]
    },
    {
      "id": "i-2",
      "text": "Verifier outage restores exact pre-run bytes, fails the run, and creates no UNVERIFIED commit or success score.",
      "confidence": "verified",
      "evidence_refs": [
        2,
        8
      ]
    },
    {
      "id": "i-3",
      "text": "Owner WIP never becomes an ancestor of a FlexFactor-published branch.",
      "confidence": "verified",
      "evidence_refs": [
        2
      ]
    },
    {
      "id": "i-4",
      "text": "Partial output never authorizes clean, ready, approval, commit publication, or merge.",
      "confidence": "verified",
      "evidence_refs": [
        2
      ]
    },
    {
      "id": "i-5",
      "text": "Untrusted dependencies run only under enforced resource, network, path, process, and time containment on Windows and Linux; unavailable controls BLOCK.",
      "confidence": "supported",
      "evidence_refs": [
        2,
        5,
        8
      ]
    },
    {
      "id": "i-6",
      "text": "Every claimed gate must have run; unknown and unavailable are not passes.",
      "confidence": "verified",
      "evidence_refs": [
        2,
        7
      ]
    },
    {
      "id": "i-7",
      "text": "A changed run cannot exit successfully until the exact reviewed SHA is proven on the authoritative remote default branch.",
      "confidence": "verified",
      "evidence_refs": [
        2
      ]
    },
    {
      "id": "i-8",
      "text": "No reviewer from any candidate author family can certify the final commit.",
      "confidence": "verified",
      "evidence_refs": [
        1,
        2
      ]
    },
    {
      "id": "i-9",
      "text": "Source is classified before cloud calls; sensitive repositories use local processing unless the owner explicitly approves an exception.",
      "confidence": "verified",
      "evidence_refs": [
        1,
        2,
        5,
        8
      ]
    },
    {
      "id": "i-10",
      "text": "Every modification binds to batch/project budgets, an immutable manifest, exact commands/evidence, tests, commit identity, and deterministic rollback.",
      "confidence": "supported",
      "evidence_refs": [
        5,
        8
      ]
    }
  ],
  "acceptance_criteria": [
    "A. Queue 1-30 targets sequentially; never overlap targets.",
    "B. Pass 1 covers the repository; passes 2-6 equal the prior verified delta.",
    "C. Evaluate the configured corroborated-competitor target between passes 1 and 2; the default is 25 and explicit run limits are honored.",
    "D. Owner coding uses subscriptions, metered APIs, then free/local.",
    "E. Target-controlled commands cross the execution broker.",
    "F. Analyze every relevant file completely or name the blocker.",
    "G. Cite purpose sources, contradictions, unknowns, and confidence before mutation.",
    "H. Partial or malformed output cannot authorize clean or approval.",
    "I. Retained corrections pass the real build and strongest suite.",
    "J. Final review excludes every candidate author family.",
    "K. Independent review covers the exact-commit patch in addressed chunks.",
    "L. HEAD movement after review revokes approval.",
    "M. Rescan, blast radius, secrets, and direct coverage complete or BLOCK.",
    "N. Live UI journeys cover roles, routes, controls, forms, accessibility, and performance.",
    "O. Capture WIP outside candidate ancestry; restore only on matching fingerprint.",
    "P. Audit and Production Ready run real repair and publication; Scout apply requires explicit authorization; never push checkpoints or force-push.",
    "Q. Protected branches use PRs and remain incomplete until merged.",
    "R. Fresh fetch proves the reviewed SHA on the authoritative default branch.",
    "S. Wheel, cloud, APK, and source identify the same release.",
    "T. Production ready requires merged main, exact-SHA CI, deployed cloud, signed APK, and live proof.",
    "U. Classify source before cloud calls; sensitive repos default local absent explicit approval.",
    "V. Contain untrusted commands with enforced resource, network, path, process, and time limits on Windows/Linux.",
    "W. Bind each modification to budgets, immutable manifest, exact commands/evidence, tests, commit, and rollback.",
    "X. Windows/Linux outage, dirty-worktree, cancellation, timeout, partial-failure, and backward-compatibility tests pass."
  ],
  "contradictions": [],
  "resolved_contradictions": [
    {
      "id": "rc-1",
      "text": "The earlier report-only default contradicted the standing owner instruction.",
      "resolution": "Audit and Production Ready perform real repair/publication with no dry-run path. Scout apply remains explicitly authorized. The September 12 Obsidian handoff reaffirms this instruction.",
      "confidence": "supported",
      "evidence_refs": [
        2,
        5,
        8
      ]
    }
  ],
  "gaps": [
    {
      "id": "g-1",
      "text": "Windows raw-socket isolation is best effort, so untrusted dependency execution cannot yet satisfy the containment requirement.",
      "confidence": "verified",
      "evidence_refs": [
        2,
        5,
        8
      ]
    },
    {
      "id": "g-4",
      "text": "The complete Windows/Linux dirty-worktree, cancellation, timeout, partial-failure, and backward-compatibility matrix is not yet evidenced.",
      "confidence": "unknown",
      "evidence_refs": [
        5,
        8
      ]
    }
  ],
  "evidence": [
    {